{
  "$schema": "https://json-schema.org/draft/2020-12/schema",
  "$id": "https://github.com/braziliany/LPL-Scriptable/data/active.schema.json",
  "title": "Tournament Router Active Selection",
  "type": "object",
  "additionalProperties": false,
  "required": [
    "generatedAt",
    "sourceUpdatedAt",
    "tournament",
    "selectedDate",
    "selectionReason",
    "matches"
  ],
  "properties": {
    "generatedAt": {
      "type": "string",
      "pattern": "^20\\d{2}-\\d{2}-\\d{2}T\\d{2}:\\d{2}:\\d{2}(?:\\.\\d{3})?Z$"
    },
    "sourceUpdatedAt": {
      "oneOf": [
        {
          "type": "string",
          "pattern": "^20\\d{2}-\\d{2}-\\d{2}T\\d{2}:\\d{2}:\\d{2}(?:\\.\\d{3})?Z$"
        },
        { "type": "null" }
      ]
    },
    "tournament": {
      "oneOf": [
        {
          "$ref": "https://github.com/braziliany/LPL-Scriptable/data/tournaments.schema.json#/$defs/tournament"
        },
        { "type": "null" }
      ]
    },
    "nextTournament": {
      "oneOf": [
        {
          "$ref": "https://github.com/braziliany/LPL-Scriptable/data/tournaments.schema.json#/$defs/tournament"
        },
        { "type": "null" }
      ]
    },
    "businessState": {
      "enum": ["MATCHES", "TOURNAMENT_FINISHED", "NO_UPCOMING"]
    },
    "selectedDate": {
      "oneOf": [
        {
          "type": "string",
          "pattern": "^20\\d{2}-\\d{2}-\\d{2}$"
        },
        { "type": "null" }
      ]
    },
    "selectionReason": { "type": "string", "minLength": 1 },
    "classification": { "const": "PARTIAL_OBSERVED" },
    "sourceAuthorization": { "const": "VERIFIED" },
    "coverageVerified": { "const": true },
    "sourceUrl": { "const": "https://lolesports.com/en-US/leagues/worlds" },
    "coverageStart": { "type": "string", "pattern": "^2026-\\d{2}-\\d{2}$" },
    "coverageEnd": { "type": "string", "pattern": "^2026-\\d{2}-\\d{2}$" },
    "matches": {
      "type": "array",
      "items": {
        "$ref": "https://github.com/braziliany/LPL-Scriptable/data/match.schema.json"
      }
    }
  },
  "allOf": [
    {
      "if": {
        "properties": { "businessState": { "const": "MATCHES" } },
        "required": ["businessState"]
      },
      "then": {
        "properties": {
          "matches": { "type": "array", "minItems": 1 },
          "selectedDate": { "type": "string" }
        }
      }
    },
    {
      "if": {
        "properties": {
          "businessState": { "enum": ["TOURNAMENT_FINISHED", "NO_UPCOMING"] }
        },
        "required": ["businessState"]
      },
      "then": {
        "properties": {
          "matches": { "type": "array", "maxItems": 0 },
          "selectedDate": { "type": "null" }
        }
      }
    },
    {
      "if": {
        "properties": { "businessState": { "const": "TOURNAMENT_FINISHED" } },
        "required": ["businessState"]
      },
      "then": { "properties": { "tournament": { "type": "object" } } }
    }
  ]
}
