{
  "generatedAt": "2026-10-21T17:03:37.827Z",
  "sourceUpdatedAt": "2026-10-15T07:00:00.000Z",
  "tournament": {
    "id": "worlds-2026",
    "name": "2026 英雄联盟全球总决赛",
    "shortName": "WORLDS 2026",
    "season": "2026",
    "region": "INTL",
    "stage": "全球总决赛",
    "startDate": "2026-10-15",
    "endDate": "2026-11-14",
    "priority": 100,
    "enabled": true,
    "schedulePath": "data/schedules/worlds-2026.json",
    "dataSource": "manual"
  },
  "nextTournament": null,
  "businessState": "NO_UPCOMING",
  "selectedDate": null,
  "selectionReason": "SMART_NO_UPCOMING_MATCHES",
  "matches": []
}
